{
  "reviewer": {
    "id": "codex-generalist-b",
    "provider": "internal-agent",
    "role": "generalist",
    "model": "codex"
  },
  "summary": "Pass with notes: no P0/P1 acceptance blockers found after the trigger and topology fixes.",
  "review_context": {
    "run_id": "2026-06-23-boundary-trace-finding-validation",
    "review_packet_path": "current uncommitted diff after review fixes",
    "reviewer_instance_id": "codex-generalist-b",
    "material_change_id": "post-review-fixes"
  },
  "findings": [
    {
      "id": "GB-001",
      "severity": "P3",
      "category": "test-precision",
      "title": "Smoke check does not pin per-artifact responsibilities",
      "evidence": [
        "tests/test_scripts_smoke.py:685",
        "tests/test_scripts_smoke.py:696",
        "tests/test_scripts_smoke.py:707"
      ],
      "why_it_matters": "The combined text assertion can miss some future responsibility drift between individual artifacts.",
      "recommendation": "Consider tightening the smoke test later with more per-file assertions for each artifact's responsibility.",
      "no_blocker_path_reason": "The current test already pins key requirements in the validation template and protocol; this is a precision improvement, not an acceptance blocker.",
      "status": "candidate-unvalidated"
    }
  ],
  "self_declared_limitations": [
    "Reviewer did not run tests or validators."
  ]
}
