{
  "reviewer": {
    "id": "verification-codex",
    "provider": "internal-agent",
    "role": "verification",
    "model": "codex"
  },
  "review_context": {
    "run_id": "2026-06-23-v0.2-pr-merge-readiness-b6662a8",
    "material_change_id": "b6662a8",
    "review_packet_path": "run-artifacts/agentsflow/runs/2026-06-23-v0.2-pr-merge-readiness-b6662a8/review-packets/verification-codex.json",
    "reviewer_instance_id": "verification-codex"
  },
  "summary": "No P0/P1 candidate findings. The reviewed packet and referenced artifacts show fresh deterministic evidence for material_change_id b6662a8: repo validation passed, pytest reports 235 passed, diff check passed, command-evidence.json records cwd/timestamps/exit codes/results/raw log paths for gate-supporting commands, and the review packet was prepared after the latest green gate. The gh pr view HTTP 401 is correctly treated as optional publication execution risk, not a local merge-readiness blocker. The current absence of final_human_merge_decision is not reported because the run is still in provider_mirrored_review and does not claim accepted_merge_ready.",
  "findings": [],
  "requests_for_additional_verification": [
    {
      "id": "REQ-VERIFY-001",
      "request": "Before any final accepted_merge_ready claim, complete and validate the expected later-phase artifacts: all six provider-mirrored reviewer reports including live Claude invocation evidence, fusion/finding validation, pr-merge-readiness-report.json, hash-bound final human merge decision, and final readiness gate evidence."
    }
  ],
  "self_declared_limitations": [
    "Reviewed only the provided packet and referenced artifacts. Did not run tests, execute scripts, modify files, create patches, or update evidence.",
    "Current artifact set is intentionally pre-final for the provider_mirrored_review phase; later-phase acceptance artifacts were not treated as missing blockers unless the run claimed accepted_merge_ready."
  ]
}
