{
  "reviewer": {
    "id": "codex-generalist",
    "provider": "internal-agent",
    "role": "generalist",
    "model": "codex"
  },
  "summary": "Needs changes: the initial Boundary Trace trigger wording drifted across the run contract, protocol and finding-validation template.",
  "review_context": {
    "run_id": "2026-06-23-boundary-trace-finding-validation",
    "review_packet_path": "current uncommitted diff",
    "reviewer_instance_id": "codex-generalist"
  },
  "findings": [
    {
      "id": "G-001",
      "severity": "P1",
      "category": "process-consistency",
      "title": "Boundary Trace triggers are inconsistent across source artifacts",
      "evidence": [
        "run-artifacts/agentsflow/runs/2026-06-23-boundary-trace-finding-validation/task.contract.md:40-49",
        "templates/finding-validation-report.md:30-36",
        "docs/review-agent-interaction-protocol.md:155-175",
        "tests/test_scripts_smoke.py:696-721"
      ],
      "why_it_matters": "The run contract described broader trigger semantics than the template/protocol enforced, so acceptance could leave contradictory guidance in the finding-validation layer.",
      "recommendation": "Align the protocol and finding-validation template trigger conditions with the run contract and strengthen the smoke check for those terms.",
      "blocker_path": "Contract trigger semantics -> finding-validation template/protocol drift -> reviewer/fusion/finding validation may apply different Boundary Trace rules -> acceptance could preserve contradictory gate guidance.",
      "acceptance_impact": "The slice would not reliably define when Boundary Trace is required.",
      "mandatory_evidence_gap": false,
      "status": "candidate-unvalidated"
    }
  ],
  "self_declared_limitations": [
    "Reviewer did not run tests or validators."
  ]
}
