{
  "reviewer": {
    "id": "codex-process-semantics",
    "provider": "internal-agent",
    "role": "process-semantics",
    "model": "codex"
  },
  "summary": "Needs changes: the run initially claimed homogeneous-dual review while planning one generalist plus one focused reviewer; trigger wording also drifted.",
  "review_context": {
    "run_id": "2026-06-23-boundary-trace-finding-validation",
    "review_packet_path": "current uncommitted diff",
    "reviewer_instance_id": "codex-process-semantics"
  },
  "findings": [
    {
      "id": "P-001",
      "severity": "P1",
      "category": "review-topology",
      "title": "Review topology evidence contradicts the planned reviewer set",
      "evidence": [
        "run-artifacts/agentsflow/runs/2026-06-23-boundary-trace-finding-validation/run.yaml:9",
        "run-artifacts/agentsflow/runs/2026-06-23-boundary-trace-finding-validation/run.yaml:35-36",
        "run-artifacts/agentsflow/runs/2026-06-23-boundary-trace-finding-validation/plan.md:26-28",
        "profiles/review_profiles/homogeneous-dual.yaml:7-18"
      ],
      "why_it_matters": "Homogeneous-dual requires two generalist reviewers with the same substantive prompt, packet, rubric, role contract and output schema; the planned set was one generalist plus one focused reviewer.",
      "recommendation": "Either run two true homogeneous generalists or reclassify the run to an existing focused topology and keep artifacts consistent.",
      "blocker_path": "Run review topology evidence -> incorrect homogeneous-dual claim -> review gate evidence becomes internally contradictory -> acceptance would rely on a misclassified review gate.",
      "acceptance_impact": "The run could not honestly claim its selected review topology.",
      "mandatory_evidence_gap": false,
      "status": "candidate-unvalidated"
    },
    {
      "id": "P-002",
      "severity": "P2",
      "category": "process-consistency",
      "title": "Boundary Trace trigger lists drift across artifacts",
      "evidence": [
        "run-artifacts/agentsflow/runs/2026-06-23-boundary-trace-finding-validation/task.contract.md:40-49",
        "templates/finding-validation-report.md:30-36",
        "docs/review-agent-interaction-protocol.md:155-162"
      ],
      "why_it_matters": "Lightweight guidance works only if the contract, protocol and template describe the same trigger set.",
      "recommendation": "Align the trigger bullets without adding a new schema, parser or validator.",
      "no_blocker_path_reason": "The issue overlaps G-001 and is actionable as consistency cleanup after G-001 is accepted.",
      "status": "candidate-unvalidated"
    }
  ],
  "self_declared_limitations": [
    "Reviewer did not run tests or validators."
  ]
}
