{
  "reviewer": {
    "id": "adversarial-codex",
    "provider": "internal-agent",
    "role": "adversarial",
    "model": "codex"
  },
  "review_context": {
    "run_id": "2026-06-23-v0.2-pr-merge-readiness-b6662a8",
    "material_change_id": "b6662a8",
    "review_packet_path": "run-artifacts/agentsflow/runs/2026-06-23-v0.2-pr-merge-readiness-b6662a8/review-packets/adversarial-codex.json",
    "reviewer_instance_id": "adversarial-codex"
  },
  "summary": "No concrete P0/P1 acceptance-blocking risk found in the provided packet and referenced artifacts. The packet does not claim accepted_merge_ready before the final hash-bound human merge decision; gh authentication failure is identified as blocking only optional post-acceptance publication, not local merge readiness; and the referenced command evidence records current b6662a8 validation, pytest, diff-check, and publication-auth status.",
  "findings": [],
  "requests_for_additional_verification": [],
  "self_declared_limitations": [
    "Read-only review only: I did not run tests, execute scripts, modify files, create patches, or update evidence.",
    "I reviewed the provided packet and referenced artifacts available to this reviewer; final fusion, finding validation, final human merge decision, final readiness report, and optional GitHub publication are later workflow phases and were not treated as current blockers."
  ]
}
